{
  "$schema": "../schemas/character.schema.json",
  "id": "ocufjaya8izaisto",
  "name": "Lady of the Lake",
  "color": null,
  "roles": [
    "zuub4hq7itul9912"
  ],
  "templates": [],
  "extraFields": [],
  "fields": {
    "title": "Enchantress"
  },
  "body": "## Overview\nGuardian of Excalibur, who raised Lancelot in her lake."
}
