{
  "$schema": "../schemas/character.schema.json",
  "id": "qk3fqkvwkv28utro",
  "name": "Gawain",
  "color": null,
  "roles": [
    "75vt2giqk5cetozt",
    "p3h388ewu5s526rs"
  ],
  "templates": [
    "8q3y3tjaoi1mj28c"
  ],
  "extraFields": [],
  "fields": {
    "title": "Knight of the Round Table",
    "liege": "King Arthur",
    "weapon": "Galatine",
    "steed": "Gringolet"
  },
  "body": "## Overview\nEldest son of King Lot of Orkney, famed for his courtesy and his strength at noon."
}
